{
  "schema_version": "1.0",
  "dataset": "wikimedia-single-person-smoke-v1",
  "upstream": "vendor/sam-3d-body",
  "checkpoint": "checkpoints/sam-3d-body-dinov3/model.ckpt",
  "mhr": "checkpoints/sam-3d-body-dinov3/assets/mhr_model.pt",
  "repeats": 3,
  "images": [{"id":"image-001","path":"private-data/image-001.jpg","ground_truth":null}],
  "output": "local-results",
  "export_mesh": true
}
